{
  "$schema": "https://raw.githubusercontent.com/rigerc/nosey/main/schemas/registry/skills-map.schema.json",
  "schemaVersion": 2,
  "registryId": "example/agent-skills",
  "alwaysRecommend": [],
  "externalSkills": [],
  "technologies": [],
  "technologySkills": [],
  "combinations": [],
  "combinationSkills": [],
  "frontendBonusSkills": [],
  "frontendPackages": [],
  "webFrontendExtensions": []
}
